{
  "schema_version": "1.0",
  "review_id": "strategy_review:st_hs_pytorch_torch_nn_functional_cosine_embedding_loss_controlled_baseline_hsr003:r2:rr1",
  "review_revision": 1,
  "parent_review_ref": null,
  "subject": {
    "strategy_id": "st_hs_pytorch_torch_nn_functional_cosine_embedding_loss_controlled_baseline_hsr003",
    "revision_number": 2,
    "content_hash": "1af2ab6f9f9aecda14907432b526d8d10b672024f628d486fad2cc1c910187f8",
    "relative_path": "experiment/EXP011_bug_aware_harness_synthesis/strategy_primitives/plans/pytorch/torch_nn_functional_cosine_embedding_loss/controlled_baseline/st_hs_pytorch_torch_nn_functional_cosine_embedding_loss_controlled_baseline_hsr003_r002.json"
  },
  "rules_ref": {
    "artifact_id": "strategy_plan_human_review_rules__v1.1__sha256_513bd2f9a69f4a3ed31328eb90dcf829ecc8c75a1a526cc8097dbabb733ac1b0.md",
    "artifact_version": "1.1",
    "content_hash": "513bd2f9a69f4a3ed31328eb90dcf829ecc8c75a1a526cc8097dbabb733ac1b0",
    "relative_path": "experiment/EXP011_bug_aware_harness_synthesis/strategy_plan_review_artifacts/strategy_plan_human_review_rules__v1.1__sha256_513bd2f9a69f4a3ed31328eb90dcf829ecc8c75a1a526cc8097dbabb733ac1b0.md"
  },
  "decision": "approved",
  "findings": [],
  "reviewer_id": "nathan",
  "reviewed_at": "2026-10-07T02:11:32.170076Z",
  "review_notes": null
}
