{
  "schema_version": "1.0",
  "review_id": "strategy_review:st_hs_pytorch_torch_batch_norm_update_stats_bug_aware_static_hsr006:r2:rr1",
  "review_revision": 1,
  "parent_review_ref": null,
  "subject": {
    "strategy_id": "st_hs_pytorch_torch_batch_norm_update_stats_bug_aware_static_hsr006",
    "revision_number": 2,
    "content_hash": "950e8c5406d41ccba78d20228055a2c57ec390f12b7007e97c0a77f207733a76",
    "relative_path": "experiment/EXP011_bug_aware_harness_synthesis/strategy_primitives/plans/pytorch/torch_batch_norm_update_stats/bug_aware_static/st_hs_pytorch_torch_batch_norm_update_stats_bug_aware_static_hsr006_r002.json"
  },
  "rules_ref": {
    "artifact_id": "strategy_plan_human_review_rules__v1.2__sha256_14d2b31692f067cf43f9301d514c04211d14328f633720f01401595159ce2720.md",
    "artifact_version": "1.2",
    "content_hash": "14d2b31692f067cf43f9301d514c04211d14328f633720f01401595159ce2720",
    "relative_path": "experiment/EXP011_bug_aware_harness_synthesis/strategy_plan_review_artifacts/strategy_plan_human_review_rules__v1.2__sha256_14d2b31692f067cf43f9301d514c04211d14328f633720f01401595159ce2720.md"
  },
  "decision": "approved",
  "findings": [],
  "reviewer_id": "nathan",
  "reviewed_at": "2026-10-07T07:04:16.778273Z",
  "review_notes": null
}
