{
  "schema_version": "1.0",
  "review_id": "strategy_review:st_hs_pytorch_torch_batch_norm_update_stats_controlled_baseline_hsr004:r3:rr1",
  "review_revision": 1,
  "parent_review_ref": null,
  "subject": {
    "strategy_id": "st_hs_pytorch_torch_batch_norm_update_stats_controlled_baseline_hsr004",
    "revision_number": 3,
    "content_hash": "660ef6e67ea4fdc1952536e751de01ab1e7120fca8af3e2d8a0469e7c3bba760",
    "relative_path": "experiment/EXP011_bug_aware_harness_synthesis/strategy_primitives/plans/pytorch/torch_batch_norm_update_stats/controlled_baseline/st_hs_pytorch_torch_batch_norm_update_stats_controlled_baseline_hsr004_r003.json"
  },
  "rules_ref": {
    "artifact_id": "strategy_plan_human_review_rules__v1.2__sha256_14d2b31692f067cf43f9301d514c04211d14328f633720f01401595159ce2720.md",
    "artifact_version": "1.2",
    "content_hash": "14d2b31692f067cf43f9301d514c04211d14328f633720f01401595159ce2720",
    "relative_path": "experiment/EXP011_bug_aware_harness_synthesis/strategy_plan_review_artifacts/strategy_plan_human_review_rules__v1.2__sha256_14d2b31692f067cf43f9301d514c04211d14328f633720f01401595159ce2720.md"
  },
  "decision": "approved",
  "findings": [],
  "reviewer_id": "nathan",
  "reviewed_at": "2026-10-07T06:52:56.104037Z",
  "review_notes": null
}
