{
  "schema_version": "1.0",
  "review_id": "strategy_review:st_hs_pytorch_torch_nn_functional_cosine_embedding_loss_bug_aware_static_hsr004:r2:rr1",
  "review_revision": 1,
  "parent_review_ref": null,
  "subject": {
    "strategy_id": "st_hs_pytorch_torch_nn_functional_cosine_embedding_loss_bug_aware_static_hsr004",
    "revision_number": 2,
    "content_hash": "b61a5949ccf1342e7d8e879be624538348e2c1b6fb4f9f4d184813163d8bb89f",
    "relative_path": "experiment/EXP011_bug_aware_harness_synthesis/strategy_primitives/plans/pytorch/torch_nn_functional_cosine_embedding_loss/bug_aware_static/st_hs_pytorch_torch_nn_functional_cosine_embedding_loss_bug_aware_static_hsr004_r002.json"
  },
  "rules_ref": {
    "artifact_id": "strategy_plan_human_review_rules__v1.2__sha256_14d2b31692f067cf43f9301d514c04211d14328f633720f01401595159ce2720.md",
    "artifact_version": "1.2",
    "content_hash": "14d2b31692f067cf43f9301d514c04211d14328f633720f01401595159ce2720",
    "relative_path": "experiment/EXP011_bug_aware_harness_synthesis/strategy_plan_review_artifacts/strategy_plan_human_review_rules__v1.2__sha256_14d2b31692f067cf43f9301d514c04211d14328f633720f01401595159ce2720.md"
  },
  "decision": "approved",
  "findings": [
    {
      "criterion_id": "SR-03",
      "severity": "advisory",
      "field_path": "$.implementation_plan.branch_strategies[1].steps",
      "evidence_ref": "construct_tensor_with_rank_range parameter bindings in knowledge branch steps 001 and 002",
      "mismatch_summary": "Input ranks vary over 1..2 and dimension lengths over 0..1. Empty/nonempty, shape equality/mismatch and rank mismatch remain reachable, but nonempty same-rank size mismatch is outside this bounded pilot domain. Retain this limitation when reporting coverage."
    }
  ],
  "reviewer_id": "nathan",
  "reviewed_at": "2026-10-07T07:04:17.792863Z",
  "review_notes": null
}
